{
  "entity_type": "environment",
  "schema_version": "1.0.0",
  "environment_id": "ENV-FIX-001",
  "environment_name": "Test Environment",
  "provider": "Test Provider",
  "model": "Test-Model-v1",
  "interface": "API",
  "search_mode": "RETRIEVAL_AUGMENTED",
  "geography": "GLOBAL",
  "language": "en",
  "status": "ACTIVE",
  "created_at": "2026-09-28T00:00:00Z",
  "notes": "Test fixture for environment"
}
